<!ELEMENT students (student+)>
<!ELEMENT student (name, id, subject, grade)>
<!ELEMENT name (#PCDATA)>
<!ELEMENT id (#PCDATA)>
<!ELEMENT subject (#PCDATA)>
<!ELEMENT grade (#PCDATA)>
